tweet_id,timestamp,text,expanded_urls,name,dog_type,ratings,jpg_url,p1,p1_conf,p1_dog,p2,p2_conf,p2_dog,p3,p3_conf,p3_dog,retweet_count,favorite_count
672481316919734272,2015-12-03 18:23:34+00:00,Say hello to Jazz. She should be on the cover of Vogue. 12/10 gorgeous pupper https://t.co/mVCMemhXAP,https://twitter.com/dog_rates/status/672481316919734272/photo/1,Jazz,pupper,1.2,https://pbs.twimg.com/media/CVUiMUeW4AEQgkU.jpg,Border_collie,0.599454,True,collie,0.106227,True,Shetland_sheepdog,0.0944649,True,137,757
672254177670729728,2015-12-03 03:21:00+00:00,This is Rolf. He's having the time of his life. 11/10 good pupper https://t.co/OO6MqEbqG3,https://twitter.com/dog_rates/status/672254177670729728/photo/1,Rolf,pupper,1.1,https://pbs.twimg.com/media/CVRTmz1WcAA4uMF.jpg,pug,0.979487,True,French_bulldog,0.0168504,True,Norwegian_elkhound,0.00161754,True,800,1515
672160042234327040,2015-12-02 21:06:56+00:00,This is Bubba. He's a Titted Peebles Aorta. Evolutionary masterpiece. Comfortable with his body. 8/10 great pupper https://t.co/aNkkl5nH3W,https://twitter.com/dog_rates/status/672160042234327040/photo/1,Bubba,pupper,0.8,https://pbs.twimg.com/media/CVP9_beUEAAwURR.jpg,pug,0.561027,True,French_bulldog,0.222114,True,Labrador_retriever,0.0654556,True,395,918
817777686764523520,2017-01-07 16:59:28+00:00,"This is Dido. She's playing the lead role in ""Pupper Stops to Catch Snow Before Resuming Shadow Box with Dried Apple."" 13/10 (IG: didodoggo) https://t.co/m7isZrOBX7",https://twitter.com/dog_rates/status/817777686764523521/video/1,Dido,puppo,1.3,https://pbs.twimg.com/ext_tw_video_thumb/817777588030476288/pu/img/KbuLpE4krHF4VdPf.jpg,curly-coated_retriever,0.733256,True,flat-coated_retriever,0.214145,True,Irish_water_spaniel,0.029769,True,3084,11901
801115127852503040,2016-11-22 17:28:25+00:00,This is Bones. He's being haunted by another doggo of roughly the same size. 12/10 deep breaths pupper everything's fine https://t.co/55Dqe0SJNj,"https://twitter.com/dog_rates/status/801115127852503040/photo/1,https://twitter.com/dog_rates/status/801115127852503040/photo/1",Bones,puppo,1.2,https://pbs.twimg.com/media/Cx4h7zHUsAAqaJd.jpg,dalmatian,0.823356,True,English_setter,0.0946019,True,bluetick,0.0219534,True,2429,8992
759793422261743616,2016-07-31 16:50:42+00:00,"Meet Maggie &amp; Lila. Maggie is the doggo, Lila is the pupper. They are sisters. Both 12/10 would pet at the same time https://t.co/MYwR4DQKll","https://twitter.com/dog_rates/status/759793422261743616/photo/1,https://twitter.com/dog_rates/status/759793422261743616/photo/1",Maggie,puppo,1.2,https://pbs.twimg.com/media/CotUFZEWcAA2Pku.jpg,golden_retriever,0.985876,True,Labrador_retriever,0.00194777,True,kuvasz,0.00175174,True,2173,6620
