tweet_id,timestamp,text,expanded_urls,name,dog_type,ratings,jpg_url,p1,p1_conf,p1_dog,p2,p2_conf,p2_dog,p3,p3_conf,p3_dog,retweet_count,favorite_count
890240255349198848,2017-07-26 15:59:51+00:00,This is Cassie. She is a college pup. Studying international doggo communication and stick theory. 14/10 so elegant much sophisticate https://t.co/t1bfwz5S2A,https://twitter.com/dog_rates/status/890240255349198849/photo/1,Cassie,doggo,1.4,https://pbs.twimg.com/media/DFrEyVuW0AAO3t9.jpg,Pembroke,0.511319,True,Cardigan,0.451038,True,Chihuahua,0.0292482,True,7711,32467
884162670584377344,2017-07-09 21:29:42+00:00,Meet Yogi. He doesn't have any important dog meetings today he just enjoys looking his best at all times. 12/10 for dangerously dapper doggo https://t.co/YSI00BzTBZ,https://twitter.com/dog_rates/status/884162670584377345/photo/1,Yogi,doggo,1.2,https://pbs.twimg.com/media/DEUtQbzW0AUTv_o.jpg,German_shepherd,0.707046,True,malinois,0.199396,True,Norwegian_elkhound,0.0491476,True,3128,20771
871515927908634624,2017-06-04 23:56:03+00:00,This is Napolean. He's a Raggedy East Nicaraguan Zoom Zoom. Runs on one leg. Built for deception. No eyes. Good with kids. 12/10 great doggo https://t.co/PR7B7w1rUw,"https://twitter.com/dog_rates/status/871515927908634625/photo/1,https://twitter.com/dog_rates/status/871515927908634625/photo/1",Napolean,doggo,1.2,https://pbs.twimg.com/media/DBg_HT9WAAEeIMM.jpg,komondor,0.974781,True,briard,0.0200413,True,swab,0.00322824,False,3628,20730
869596645499047936,2017-05-30 16:49:31+00:00,This is Scout. He just graduated. Officially a doggo now. Have fun with taxes and losing sight of your ambitions. 12/10 would throw cap for https://t.co/DsA2hwXAJo,"https://twitter.com/dog_rates/status/869596645499047938/photo/1,https://twitter.com/dog_rates/status/869596645499047938/photo/1",Scout,doggo,1.2,https://pbs.twimg.com/media/DBFtiYqWAAAsjj1.jpg,Chihuahua,0.955156,True,toy_terrier,0.00805373,True,muzzle,0.00629563,False,3327,16476
846514051647705088,2017-03-28 00:07:32+00:00,This is Barney. He's an elder doggo. Hitches a ride when he gets tired. Waves goodbye before he leaves. 13/10 please come back soon https://t.co/cFAasDXauK,"https://twitter.com/dog_rates/status/846514051647705089/photo/1,https://twitter.com/dog_rates/status/846514051647705089/photo/1,https://twitter.com/dog_rates/status/846514051647705089/photo/1",Barney,doggo,1.3,https://pbs.twimg.com/media/C79sB4xXwAEvwKY.jpg,golden_retriever,0.650003,True,Leonberg,0.0651992,True,Norfolk_terrier,0.0529553,True,13076,48410
845397057150107648,2017-03-24 22:08:59+00:00,"Say hello to Mimosa. She's an emotional support doggo who helps her owner with PTSD. 13/10, but she needs your help

https://t.co/L6mLzrd7Mx https://t.co/jMutBFdw5o","https://www.gofundme.com/help-save-a-pup,https://twitter.com/dog_rates/status/845397057150107648/photo/1,https://twitter.com/dog_rates/status/845397057150107648/photo/1",Mimosa,doggo,1.3,https://pbs.twimg.com/media/C7t0IzLWkAINoft.jpg,Dandie_Dinmont,0.394404,True,Maltese_dog,0.186537,True,West_Highland_white_terrier,0.181985,True,2072,8241
832998151111966720,2017-02-18 17:00:10+00:00,"This is Rhino. He arrived at a shelter with an elaborate doggo manual for his new family, written by someone who will always love him. 13/10 https://t.co/QX1h0oqMz0","https://twitter.com/dog_rates/status/832998151111966721/photo/1,https://twitter.com/dog_rates/status/832998151111966721/photo/1",Rhino,doggo,1.3,https://pbs.twimg.com/media/C49nZavUYAEJjGw.jpg,boxer,0.539036,True,French_bulldog,0.317617,True,bull_mastiff,0.0939285,True,2522,14549
832273440279240704,2017-02-16 17:00:25+00:00,Say hello to Smiley. He's a blind therapy doggo having a h*ckin blast high steppin around in the snow. 14/10 would follow anywhere https://t.co/SHAb1wHjMz,https://twitter.com/dog_rates/status/832273440279240704/video/1,Smiley,doggo,1.4,https://pbs.twimg.com/ext_tw_video_thumb/832273373149413377/pu/img/qOqxM0b48fEarmq6.jpg,Pembroke,0.134081,True,ice_bear,0.0519278,False,pug,0.0443109,True,2673,12385
832032802820481024,2017-02-16 01:04:13+00:00,"This is Miguel. He was the only remaining doggo at the adoption center after the weekend. Let's change that. 12/10

https://t.co/P0bO8mCQwN https://t.co/SU4K34NT4M","https://www.petfinder.com/petdetail/34918210,https://twitter.com/dog_rates/status/832032802820481025/photo/1,https://twitter.com/dog_rates/status/832032802820481025/photo/1,https://twitter.com/dog_rates/status/832032802820481025/photo/1,https://twitter.com/dog_rates/status/832032802820481025/photo/1",Miguel,doggo,1.2,https://pbs.twimg.com/media/C4v5a4UWcAIRygc.jpg,whippet,0.601712,True,Ibizan_hound,0.152662,True,Italian_greyhound,0.135055,True,4746,13887
831939777352105984,2017-02-15 18:54:34+00:00,This is Emanuel. He's a h*ckin rare doggo. Dwells in a semi-urban environment. Round features make him extra collectible. 12/10 would so pet https://t.co/k9bzgyVdUT,https://twitter.com/dog_rates/status/831939777352105988/photo/1,Emanuel,doggo,1.2,https://pbs.twimg.com/media/C4uk0EWWQAAaZm1.jpg,Pomeranian,0.153862,True,marmot,0.0912339,False,grey_fox,0.0906441,False,7031,26404
831322785565769728,2017-02-14 02:02:51+00:00,This is Pete. He has no eyes. Needs a guide doggo. Also appears to be considerably fluffy af. 12/10 would hug softly https://t.co/Xc0gyovCtK,https://twitter.com/dog_rates/status/831322785565769729/photo/1,Pete,doggo,1.2,https://pbs.twimg.com/media/C4lzqQ4UEAApzU0.jpg,Old_English_sheepdog,0.999715,True,Tibetan_terrier,4.62967e-05,True,guinea_pig,4.118430000000001e-05,False,1744,10042
829374341691346944,2017-02-08 17:00:26+00:00,This is Astrid. She's a guide doggo in training. 13/10 would follow anywhere https://t.co/xo7FZFIAao,"https://twitter.com/dog_rates/status/829374341691346946/photo/1,https://twitter.com/dog_rates/status/829374341691346946/photo/1",Astrid,doggo,1.3,https://pbs.twimg.com/media/C4KHj-nWQAA3poV.jpg,Staffordshire_bullterrier,0.757547,True,American_Staffordshire_terrier,0.14995,True,Chesapeake_Bay_retriever,0.0475227,True,10706,38074
828381636999917568,2017-02-05 23:15:47+00:00,Meet Doobert. He's a deaf doggo. Didn't stop him on the field tho. Absolute legend today. 14/10 would pat head approvingly https://t.co/iCk7zstRA9,https://twitter.com/dog_rates/status/828381636999917570/photo/1,Doobert,doggo,1.4,https://pbs.twimg.com/media/C38Asz1WEAAvzj3.jpg,Bedlington_terrier,0.392535,True,Labrador_retriever,0.0890217,True,clumber,0.0817998,True,2554,13864
826958653328592896,2017-02-02 01:01:21+00:00,This is Loki. He smiles like Elvis. Ain't nothin but a hound doggo. 12/10 https://t.co/QV5nx6otZR,https://twitter.com/dog_rates/status/826958653328592898/photo/1,Loki,doggo,1.2,https://pbs.twimg.com/media/C3nygbBWQAAjwcW.jpg,golden_retriever,0.6173890000000001,True,Labrador_retriever,0.33705300000000005,True,tennis_ball,0.00855442,False,5757,23767
826848821049180160,2017-02-01 17:44:55+00:00,This is Cupid. He was found in the trash. Now he's well on his way to prosthetic front legs and a long happy doggo life. 13/10 heroic af https://t.co/WS0Gha8vRh,"https://twitter.com/dog_rates/status/826848821049180160/photo/1,https://twitter.com/dog_rates/status/826848821049180160/photo/1,https://twitter.com/dog_rates/status/826848821049180160/photo/1,https://twitter.com/dog_rates/status/826848821049180160/photo/1",Cupid,doggo,1.3,https://pbs.twimg.com/media/C3mOnZ_XUAAjr2V.jpg,Great_Pyrenees,0.858764,True,golden_retriever,0.0235257,True,Pekinese,0.017103900000000002,True,11878,40325
826476773533745152,2017-01-31 17:06:32+00:00,This is Pilot. He has mastered the synchronized head tilt and sneaky tongue slip. Usually not unlocked until later doggo days. 12/10 https://t.co/YIV8sw8xkh,https://twitter.com/dog_rates/status/826476773533745153/photo/1,Pilot,doggo,1.2,https://pbs.twimg.com/media/C3g8M0lWIAEcFgn.jpg,German_shepherd,0.7418600000000001,True,Tibetan_mastiff,0.122812,True,kelpie,0.10046,True,4821,20275
821765923262631936,2017-01-18 17:07:18+00:00,This is Duchess. She uses dark doggo forces to levitate her toys. 13/10 magical af https://t.co/maDNMETA52,https://twitter.com/dog_rates/status/821765923262631936/photo/1,Duchess,doggo,1.3,https://pbs.twimg.com/media/C2d_vnHWEAE9phX.jpg,golden_retriever,0.980071,True,Labrador_retriever,0.00875751,True,Saluki,0.00180595,True,1899,9317
821407182352777216,2017-01-17 17:21:47+00:00,This is Sundance. He's a doggo drummer. Even sings a bit on the side. 14/10 entertained af (vid by @sweetsundance) https://t.co/Xn5AQtiqzG,https://twitter.com/dog_rates/status/821407182352777218/video/1,Sundance,doggo,1.4,https://pbs.twimg.com/ext_tw_video_thumb/821407155391725568/pu/img/AJC07gFJDDBuwNTD.jpg,Irish_setter,0.5054960000000001,True,vizsla,0.168747,True,Chesapeake_Bay_retriever,0.111311,True,5053,13075
819004803107983360,2017-01-11 02:15:36+00:00,This is Bo. He was a very good First Doggo. 14/10 would be an absolute honor to pet https://t.co/AdPKrI8BZ1,"https://twitter.com/dog_rates/status/819004803107983360/photo/1,https://twitter.com/dog_rates/status/819004803107983360/photo/1,https://twitter.com/dog_rates/status/819004803107983360/photo/1,https://twitter.com/dog_rates/status/819004803107983360/photo/1",Bo,doggo,1.4,https://pbs.twimg.com/media/C12whDoVEAALRxa.jpg,standard_poodle,0.351308,True,toy_poodle,0.271929,True,Tibetan_terrier,0.0947592,True,42228,95450
813910438903693312,2016-12-28 00:52:25+00:00,This is Chubbs. He dug a hole and now he's stuck in it. Dang h*ckin doggo. 11/10 would assist https://t.co/z1VRj1cYZf,https://twitter.com/dog_rates/status/813910438903693312/photo/1,Chubbs,doggo,1.1,https://pbs.twimg.com/media/C0uXObSXUAAIzmV.jpg,Siberian_husky,0.6993550000000001,True,Eskimo_dog,0.256433,True,Norwegian_elkhound,0.0131888,True,2194,10342
813096984823349248,2016-12-25 19:00:02+00:00,This is Rocky. He got triple-doggo-dared. Stuck af. 11/10 someone help him https://t.co/soNL00XWVu,https://twitter.com/dog_rates/status/813096984823349248/photo/1,Rocky,doggo,1.1,https://pbs.twimg.com/media/C0izZULWgAAKD-F.jpg,Great_Dane,0.128056,True,Boston_bull,0.117003,True,kelpie,0.08696430000000001,True,4207,11694
799757965289017344,2016-11-18 23:35:32+00:00,This is Sobe. She's a h*ckin happy doggo. Only one leg tho. Must have good balance. 13/10 would smile back https://t.co/OiH8PaOxB1,"https://twitter.com/dog_rates/status/799757965289017345/photo/1,https://twitter.com/dog_rates/status/799757965289017345/photo/1,https://twitter.com/dog_rates/status/799757965289017345/photo/1,https://twitter.com/dog_rates/status/799757965289017345/photo/1",Sobe,doggo,1.3,https://pbs.twimg.com/media/CxlPnoSUcAEXf1i.jpg,Border_collie,0.442534,True,collie,0.288684,True,Shetland_sheepdog,0.196399,True,2506,9390
786363235746385920,2016-10-13 00:29:39+00:00,This is Rizzo. He has many talents. A true renaissance doggo. 13/10 entertaining af https://t.co/TVXpEJB7Wn,"https://twitter.com/dog_rates/status/786363235746385920/photo/1,https://twitter.com/dog_rates/status/786363235746385920/photo/1,https://twitter.com/dog_rates/status/786363235746385920/photo/1,https://twitter.com/dog_rates/status/786363235746385920/photo/1",Rizzo,doggo,1.3,https://pbs.twimg.com/media/Cum5LlfWAAAyPcS.jpg,golden_retriever,0.929266,True,Labrador_retriever,0.0628667,True,Saluki,0.00215669,True,4072,12189
782747134529531904,2016-10-03 01:00:34+00:00,This is Deacon. He's the happiest almost dry doggo I've ever seen. 11/10 would smile back https://t.co/C6fUMnHt1H,https://twitter.com/dog_rates/status/782747134529531904/photo/1,Deacon,doggo,1.1,https://pbs.twimg.com/media/CtzgXgeXYAA1Gxw.jpg,golden_retriever,0.560699,True,otterhound,0.199482,True,clumber,0.0406818,True,1604,8310
782305867769217024,2016-10-01 19:47:08+00:00,This is Sampson. He just graduated. Ready to be a doggo now. Time for the real world. 12/10 have fun with taxes https://t.co/pgVKxRw0s1,"https://twitter.com/dog_rates/status/782305867769217024/photo/1,https://twitter.com/dog_rates/status/782305867769217024/photo/1,https://twitter.com/dog_rates/status/782305867769217024/photo/1",Sampson,doggo,1.2,https://pbs.twimg.com/media/CttPBt0WIAAcsDE.jpg,briard,0.5044270000000001,True,soft-coated_wheaten_terrier,0.390678,True,Lhasa,0.0345955,True,6470,18630
775364825476165632,2016-09-12 16:05:54+00:00,This is Finley. He's an independent doggo still adjusting to life on his own. 11/10 https://t.co/7FNcBaKbci,"https://twitter.com/dog_rates/status/775364825476165632/photo/1,https://twitter.com/dog_rates/status/775364825476165632/photo/1,https://twitter.com/dog_rates/status/775364825476165632/photo/1,https://twitter.com/dog_rates/status/775364825476165632/photo/1",Finley,doggo,1.1,https://pbs.twimg.com/media/CsKmMB2WAAAXcAy.jpg,beagle,0.571229,True,Chihuahua,0.175257,True,Pembroke,0.034306300000000005,True,3472,8295
760893934457552896,2016-08-03 17:43:45+00:00,This is Wishes. He has the day off. Daily struggles of being a doggo have finally caught up with him. 11/10 https://t.co/H9YgrUkYwa,https://twitter.com/dog_rates/status/760893934457552897/photo/1,Wishes,doggo,1.1,https://pbs.twimg.com/media/Co88_ujWEAErCg7.jpg,Blenheim_spaniel,0.113992,True,cocker_spaniel,0.10578,True,borzoi,0.0739345,True,1104,4228
748932637671223296,2016-07-01 17:33:49+00:00,Say hello to Divine Doggo. Must be magical af. 13/10 would be an honor to pet https://t.co/BbcABzohKb,https://twitter.com/dog_rates/status/748932637671223296/photo/1,Divine,doggo,1.3,https://pbs.twimg.com/media/CmS-QkQWAAAkUa-.jpg,borzoi,0.742912,True,wire-haired_fox_terrier,0.204082,True,English_setter,0.0210323,True,2564,6461
735256018284875776,2016-05-24 23:47:49+00:00,This is Kellogg. He accidentally opened the front facing camera. 8/10 get it together doggo https://t.co/MRYv7nDPyS,https://twitter.com/dog_rates/status/735256018284875776/photo/1,Kellogg,doggo,0.8,https://pbs.twimg.com/media/CjQnclkVEAA4pnK.jpg,Staffordshire_bullterrier,0.523191,True,French_bulldog,0.351104,True,doormat,0.0280753,False,993,3675
883360690899218432,2017-07-07 16:22:55+00:00,Meet Grizzwald. He may be the floofiest floofer I ever did see. Lost eyes saving a schoolbus from a volcano erpuption. 13/10 heroic as h*ck https://t.co/rf661IFEYP,https://twitter.com/dog_rates/status/883360690899218434/photo/1,Grizzwald,floofer,1.3,https://pbs.twimg.com/media/DEJT3FeXoAAtwUy.jpg,chow,0.987997,True,Tibetan_mastiff,0.00709872,True,Newfoundland,0.00214033,True,3825,22986
800388270626521088,2016-11-20 17:20:08+00:00,This is Doc. He takes time out of every day to worship our plant overlords. 12/10 quite the floofer https://t.co/azMneS6Ly5,"https://twitter.com/dog_rates/status/800388270626521089/photo/1,https://twitter.com/dog_rates/status/800388270626521089/photo/1,https://twitter.com/dog_rates/status/800388270626521089/photo/1",Doc,floofer,1.2,https://pbs.twimg.com/media/CxuM3oZW8AEhO5z.jpg,golden_retriever,0.35986,True,Pembroke,0.194207,True,collie,0.154603,True,3265,12456
749317047558017024,2016-07-02 19:01:20+00:00,This is Blu. He's a wild bush Floofer. I wish anything made me as happy as bushes make Blu. 12/10 would frolic with https://t.co/HHUAnBb6QB,https://twitter.com/dog_rates/status/749317047558017024/video/1,Blu,floofer,1.2,https://pbs.twimg.com/ext_tw_video_thumb/749316899712950272/pu/img/nvZI9mkoAxt89sul.jpg,wire-haired_fox_terrier,0.155144,True,Lakeland_terrier,0.108382,True,buckeye,0.0746167,False,2509,6076
733822306246479872,2016-05-21 00:50:46+00:00,This is Moose. He's a Polynesian Floofer. Dapper af. 10/10 would pet diligently https://t.co/mVfqRdppTL,https://twitter.com/dog_rates/status/733822306246479872/photo/1,Moose,floofer,1.0,https://pbs.twimg.com/media/Ci8Pfg_UUAA2m9i.jpg,Lhasa,0.457356,True,Shih-Tzu,0.371282,True,Tibetan_terrier,0.048359,True,1141,4015
685307451701334016,2016-01-08 03:50:03+00:00,Say hello to Petrick. He's an Altostratus Floofer. Just had a run in with a trash bag. Groovy checkered floor. 11/10 https://t.co/rwW7z1JAOF,https://twitter.com/dog_rates/status/685307451701334016/photo/1,Petrick,floofer,1.1,https://pbs.twimg.com/media/CYKzfTTWMAEeTN7.jpg,Pomeranian,0.963176,True,Shetland_sheepdog,0.0194683,True,keeshond,0.00860493,True,496,2262
886366144734445568,2017-07-15 23:25:31+00:00,This is Roscoe. Another pupper fallen victim to spontaneous tongue ejections. Get the BlepiPen immediate. 12/10 deep breaths Roscoe https://t.co/RGE08MIJox,"https://twitter.com/dog_rates/status/886366144734445568/photo/1,https://twitter.com/dog_rates/status/886366144734445568/photo/1",Roscoe,pupper,1.2,https://pbs.twimg.com/media/DE0BTnQUwAApKEH.jpg,French_bulldog,0.999201,True,Chihuahua,0.000361178,True,Boston_bull,7.55616e-05,True,3316,21524
882762694511734784,2017-07-06 00:46:41+00:00,This is Gus. He's quite the cheeky pupper. Already perfected the disinterested wink. 12/10 would let steal my girl https://t.co/D43I96SlVu,https://twitter.com/dog_rates/status/882762694511734784/photo/1,Gus,pupper,1.2,https://pbs.twimg.com/media/DEAz_HHXsAA-p_z.jpg,Labrador_retriever,0.85005,True,Chesapeake_Bay_retriever,0.074257,True,flat-coated_retriever,0.015579399999999997,True,5134,28903
876838120628539392,2017-06-19 16:24:33+00:00,This is Ginger. She's having a ruff Monday. Too many pupper things going on. H*ckin exhausting. 12/10 would snug passionately https://t.co/j211oCDRs6,"https://twitter.com/dog_rates/status/876838120628539392/photo/1,https://twitter.com/dog_rates/status/876838120628539392/photo/1",Ginger,pupper,1.2,https://pbs.twimg.com/media/DCsnnZsVwAEfkyi.jpg,bloodhound,0.575751,True,redbone,0.24097,True,Tibetan_mastiff,0.08893480000000001,True,3506,21125
874296783580663808,2017-06-12 16:06:11+00:00,This is Jed. He may be the fanciest pupper in the game right now. Knows it too. 13/10 would sign modeling contract https://t.co/0YplNnSMEm,https://twitter.com/dog_rates/status/874296783580663808/photo/1,Jed,pupper,1.3,https://pbs.twimg.com/media/DCIgSR0XgAANEOY.jpg,cocker_spaniel,0.437216,True,miniature_poodle,0.277191,True,toy_poodle,0.157402,True,4308,26651
873213775632977920,2017-06-09 16:22:42+00:00,"This is Sierra. She's one precious pupper. Absolute 12/10. Been in and out of ICU her whole life. Help Sierra below

https://t.co/Xp01EU3qyD https://t.co/V5lkvrGLdQ","https://www.gofundme.com/help-my-baby-sierra-get-better,https://twitter.com/dog_rates/status/873213775632977920/photo/1,https://twitter.com/dog_rates/status/873213775632977920/photo/1",Sierra,pupper,1.2,https://pbs.twimg.com/media/DB5HTBGXUAE0TiK.jpg,vizsla,0.6197819999999999,True,bloodhound,0.338069,True,Chesapeake_Bay_retriever,0.0126763,True,1667,7467
871762521631449088,2017-06-05 16:15:56+00:00,This is Rover. As part of pupper protocol he had to at least attempt to eat the plant. Confirmed not tasty. Needs peanut butter. 12/10 https://t.co/AiVljI6QCg,"https://twitter.com/dog_rates/status/871762521631449091/photo/1,https://twitter.com/dog_rates/status/871762521631449091/photo/1,https://twitter.com/dog_rates/status/871762521631449091/photo/1",Rover,pupper,1.2,https://pbs.twimg.com/media/DBkfY58XcAEdzZy.jpg,Labrador_retriever,0.921393,True,golden_retriever,0.064608,True,bloodhound,0.00338337,True,3678,20787
866450705531457536,2017-05-22 00:28:40+00:00,"This is Jamesy. He gives a kiss to every other pupper he sees on his walk. 13/10 such passion, much tender https://t.co/wk7TfysWHr","https://twitter.com/dog_rates/status/866450705531457537/photo/1,https://twitter.com/dog_rates/status/866450705531457537/photo/1",Jamesy,pupper,1.3,https://pbs.twimg.com/media/DAZAUfBXcAAG_Nn.jpg,French_bulldog,0.905334,True,Boston_bull,0.0780597,True,pug,0.00177092,True,32883,106827
850019790995546112,2017-04-06 16:18:05+00:00,Say hello to Boomer. He's a sandy pupper. Having a h*ckin blast. 12/10 would pet passionately https://t.co/ecb3LvExde,"https://twitter.com/dog_rates/status/850019790995546112/photo/1,https://twitter.com/dog_rates/status/850019790995546112/photo/1,https://twitter.com/dog_rates/status/850019790995546112/photo/1",Boomer,pupper,1.2,https://pbs.twimg.com/media/C8vgfTsXgAA561h.jpg,Shetland_sheepdog,0.759907,True,collie,0.107405,True,Pembroke,0.052335300000000015,True,5459,21944
845306882940190720,2017-03-24 16:10:40+00:00,This is Pickles. She's a silly pupper. Thinks she's a dish. 12/10 would dry https://t.co/7mPCF4ZwEk,https://twitter.com/dog_rates/status/845306882940190720/photo/1,Pickles,pupper,1.2,https://pbs.twimg.com/media/C7siH5DXkAACnDT.jpg,Irish_water_spaniel,0.567475,True,Labrador_retriever,0.169496,True,curly-coated_retriever,0.101518,True,6039,25225
837110210464448512,2017-03-02 01:20:01+00:00,This is Clark. He passed pupper training today. Round of appaws for Clark. 13/10 https://t.co/7pUjwe8X6B,https://twitter.com/dog_rates/status/837110210464448512/photo/1,Clark,pupper,1.3,https://pbs.twimg.com/media/C54DS1kXQAEU5pS.jpg,Siberian_husky,0.767696,True,Eskimo_dog,0.217079,True,malamute,0.0116568,True,2731,17480
833124694597443584,2017-02-19 01:23:00+00:00,This is Gidget. She's a spy pupper. Stealthy as h*ck. Must've slipped pup and got caught. 12/10 would forgive then pet https://t.co/zD97KYFaFa,"https://twitter.com/dog_rates/status/833124694597443584/photo/1,https://twitter.com/dog_rates/status/833124694597443584/photo/1,https://twitter.com/dog_rates/status/833124694597443584/photo/1",Gidget,pupper,1.2,https://pbs.twimg.com/media/C4_ad1IUoAEspsk.jpg,Cardigan,0.7105229999999999,True,kelpie,0.106102,True,shopping_cart,0.0554755,False,5513,22133
827933404142436352,2017-02-04 17:34:40+00:00,This is Kona. Yesterday she stopped by the department to see what it takes to be a police pupper. 12/10 vest was only a smidge too big https://t.co/j8D3PQJvpJ,"https://twitter.com/dog_rates/status/827933404142436356/photo/1,https://twitter.com/dog_rates/status/827933404142436356/photo/1,https://twitter.com/dog_rates/status/827933404142436356/photo/1",Kona,pupper,1.2,https://pbs.twimg.com/media/C31pCN4UcAAOLNH.jpg,German_shepherd,0.8061149999999999,True,Tibetan_mastiff,0.104831,True,kelpie,0.0381482,True,5987,22180
822462944365645824,2017-01-20 15:17:01+00:00,"This is Gabe. He was the unequivocal embodiment of a dream meme, but also one h*ck of a pupper. You will be missed by so many. 14/10 RIP https://t.co/M3hZGadUuO","https://twitter.com/dog_rates/status/822462944365645825/photo/1,https://twitter.com/dog_rates/status/822462944365645825/photo/1,https://twitter.com/dog_rates/status/822462944365645825/photo/1,https://twitter.com/dog_rates/status/822462944365645825/photo/1",Gabe,pupper,1.4,https://pbs.twimg.com/media/C2n5rUUXEAIXAtv.jpg,Pomeranian,0.960199,True,Samoyed,0.0230563,True,Maltese_dog,0.00894488,True,17209,31800
814986499976527872,2016-12-31 00:08:17+00:00,This is Cooper. Someone attacked him with a sharpie. Poor pupper. 11/10 nifty tongue slip tho https://t.co/01vpuRDXQ8,https://twitter.com/dog_rates/status/814986499976527872/photo/1,Cooper,pupper,1.1,https://pbs.twimg.com/media/C09p5dJWIAE5qKL.jpg,dalmatian,0.999828,True,boxer,6.78061e-05,True,American_Staffordshire_terrier,3.42436e-05,True,1505,8485
811386762094317568,2016-12-21 01:44:13+00:00,This is Craig. That's actually a normal sized fence he's stuck on. H*ckin massive pupper. 11/10 someone help him https://t.co/aAUXzoxaBy,https://twitter.com/dog_rates/status/811386762094317568/photo/1,Craig,pupper,1.1,https://pbs.twimg.com/media/C0Kf9PtWQAEW4sE.jpg,Pembroke,0.804177,True,Cardigan,0.18989,True,beagle,0.00196475,True,7444,23302
807621403335917568,2016-12-10 16:22:02+00:00,This is Ollie Vue. He was a 3 legged pupper on a mission to overcome everything. This is very hard to write. 14/10 we will miss you Ollie https://t.co/qTRY2qX9y4,"https://twitter.com/dog_rates/status/807621403335917568/photo/1,https://twitter.com/dog_rates/status/807621403335917568/photo/1,https://twitter.com/dog_rates/status/807621403335917568/photo/1,https://twitter.com/dog_rates/status/807621403335917568/photo/1",Ollie,pupper,1.4,https://pbs.twimg.com/media/CzU_YVGUUAA3Xsd.jpg,golden_retriever,0.873233,True,cocker_spaniel,0.0336933,True,chow,0.0204084,True,4288,16236
778027034220126208,2016-09-20 00:24:34+00:00,This is Sophie. She's a Jubilant Bush Pupper. Super h*ckin rare. Appears at random just to smile at the locals. 11.27/10 would smile back https://t.co/QFaUiIHxHq,https://twitter.com/dog_rates/status/778027034220126208/photo/1,Sophie,pupper,1.1,https://pbs.twimg.com/media/Cswbc2yWcAAVsCJ.jpg,clumber,0.946718,True,cocker_spaniel,0.0159499,True,Lhasa,0.00651911,True,1885,7320
776477788987613184,2016-09-15 17:48:25+00:00,This is Huck. He's addicted to caffeine. Hope it's not too latte to seek help. 11/10 stay strong pupper https://t.co/iJE3F0VozW,"https://twitter.com/dog_rates/status/776477788987613185/photo/1,https://twitter.com/dog_rates/status/776477788987613185/photo/1",Huck,pupper,1.1,https://pbs.twimg.com/media/CsaaaaxWgAEfzM7.jpg,Labrador_retriever,0.8848389999999999,True,Chesapeake_Bay_retriever,0.0575651,True,paintbrush,0.00576608,False,3249,9858
773547596996571136,2016-09-07 15:44:53+00:00,This is Chelsea. She forgot how to dog. 11/10 get it together pupper https://t.co/nBJ5RE4yHb,https://twitter.com/dog_rates/status/773547596996571136/photo/1,Chelsea,pupper,1.1,https://pbs.twimg.com/media/Crwxb5yWgAAX5P_.jpg,Norwegian_elkhound,0.372202,True,Chesapeake_Bay_retriever,0.13718699999999998,True,malamute,0.07143619999999999,True,7126,24553
772193107915964416,2016-09-03 22:02:38+00:00,This is Willem. He's a Penn State pupper. Thinks the hood makes him more intimidating. It doesn't. 12/10 https://t.co/Dp0s7MRIHK,https://twitter.com/dog_rates/status/772193107915964416/photo/1,Willem,pupper,1.2,https://pbs.twimg.com/media/Crdhh_1XEAAHKHi.jpg,Pembroke,0.367945,True,Chihuahua,0.223522,True,Pekinese,0.164871,True,1612,6665
