tweet_id,timestamp,text,expanded_urls,name,dog_type,ratings,jpg_url,p1,p1_conf,p1_dog,p2,p2_conf,p2_dog,p3,p3_conf,p3_dog,retweet_count,favorite_count
765371061932261376,2016-08-16 02:14:15+00:00,This is Louie. He's had a long day. Did a lot of pupper things. Also appears to be rather heckin pettable. 11/10 https://t.co/w2qDmoTIZ5,"https://twitter.com/dog_rates/status/765371061932261376/photo/1,https://twitter.com/dog_rates/status/765371061932261376/photo/1",Louie,pupper,1.1,https://pbs.twimg.com/media/Cp8k6oRWcAUL78U.jpg,golden_retriever,0.829456,True,Labrador_retriever,0.08937089999999999,True,kuvasz,0.0170275,True,2475,7842
756939218950160384,2016-07-23 19:49:07+00:00,This is Jax. He is a majestic mountain pupper. Thinks flat ground is for the weak. 12/10 would totally hike with https://t.co/KGdeHuFJnH,https://twitter.com/dog_rates/status/756939218950160384/photo/1,Jax,pupper,1.2,https://pbs.twimg.com/media/CoEwMXeWEAAaIz5.jpg,golden_retriever,0.790371,True,cocker_spaniel,0.130268,True,Labrador_retriever,0.0646287,True,2295,7342
750868782890057728,2016-07-07 01:47:22+00:00,Meet Milo. He hauled ass until he ran out of treadmill and then passed out from exhaustion. 11/10 sleep tight pupper https://t.co/xe1aGZNkcC,"https://twitter.com/dog_rates/status/750868782890057730/photo/1,https://twitter.com/dog_rates/status/750868782890057730/photo/1,https://twitter.com/dog_rates/status/750868782890057730/photo/1,https://twitter.com/dog_rates/status/750868782890057730/photo/1",Milo,pupper,1.1,https://pbs.twimg.com/media/CmufLLsXYAAsU0r.jpg,toy_poodle,0.912648,True,miniature_poodle,0.0350592,True,seat_belt,0.0263756,False,1595,5306
750383411068534784,2016-07-05 17:38:41+00:00,This is Zoe. She was trying to stealthily take a picture of you but you just noticed. 9/10 not so sneaky pupper https://t.co/FfH3o88Vta,https://twitter.com/dog_rates/status/750383411068534784/photo/1,Zoe,pupper,0.9,https://pbs.twimg.com/media/CmnluwbXEAAqnkw.jpg,Border_collie,0.672791,True,collie,0.270188,True,papillon,0.0345039,True,1309,5005
749417653287129088,2016-07-03 01:41:06+00:00,This is Finn. He's the most unphotogenic pupper of all time. 11/10 https://t.co/qvA2rCUl6v,"https://twitter.com/dog_rates/status/749417653287129088/photo/1,https://twitter.com/dog_rates/status/749417653287129088/photo/1,https://twitter.com/dog_rates/status/749417653287129088/photo/1,https://twitter.com/dog_rates/status/749417653287129088/photo/1",Finn,pupper,1.1,https://pbs.twimg.com/media/CmZ3YH9WEAAowi3.jpg,papillon,0.772894,True,Shetland_sheepdog,0.0424076,True,collie,0.0423131,True,1904,6721
741743634094141440,2016-06-11 21:27:17+00:00,Meet Aqua. She's a sandy pupper. Not sure how she feels about being so sandy. Radical tongue slip. 11/10 petable af https://t.co/rYxJ0UQtbE,"https://twitter.com/dog_rates/status/741743634094141440/photo/1,https://twitter.com/dog_rates/status/741743634094141440/photo/1,https://twitter.com/dog_rates/status/741743634094141440/photo/1",Aqua,pupper,1.1,https://pbs.twimg.com/media/Cksz42EW0AAh2NF.jpg,Labrador_retriever,0.786089,True,flat-coated_retriever,0.0486524,True,Chesapeake_Bay_retriever,0.0346933,True,3144,8945
739606147276148736,2016-06-05 23:53:41+00:00,Meet Benji. He just turned 1. Has already given up on a traditional pupper physique. Just inhaled that thing. 9/10 https://t.co/sLUC4th3Zj,"https://twitter.com/dog_rates/status/739606147276148736/photo/1,https://twitter.com/dog_rates/status/739606147276148736/photo/1,https://twitter.com/dog_rates/status/739606147276148736/photo/1",Benji,pupper,0.9,https://pbs.twimg.com/media/CkOb3FXW0AAUL_U.jpg,Blenheim_spaniel,0.933755,True,cocker_spaniel,0.0417194,True,Brittany_spaniel,0.00671256,True,1876,5897
735137028879360000,2016-05-24 15:55:00+00:00,Meet Buckley. His family &amp; some neighbors came over to watch him perform but he's nervous af. 9/10 u got this pupper https://t.co/5bdCpPlno9,https://twitter.com/dog_rates/status/735137028879360001/photo/1,Buckley,pupper,0.9,https://pbs.twimg.com/media/CjO7OfeWgAAUQy-.jpg,Walker_hound,0.413535,True,beagle,0.233891,True,English_foxhound,0.164943,True,1092,3428
730573383004487680,2016-05-12 01:40:42+00:00,This is Rooney. He can't comprehend glass. 10/10 it'll be ok pupper https://t.co/CnUl2uDBBV,"https://twitter.com/dog_rates/status/730573383004487680/photo/1,https://twitter.com/dog_rates/status/730573383004487680/photo/1,https://twitter.com/dog_rates/status/730573383004487680/photo/1",Rooney,pupper,1.0,https://pbs.twimg.com/media/CiOEnI6WgAAmq4E.jpg,American_Staffordshire_terrier,0.810158,True,Labrador_retriever,0.058204999999999986,True,Weimaraner,0.027929500000000003,True,2435,5407
728015554473250816,2016-05-05 00:16:48+00:00,This is Rueben. He has reached ultimate pupper zen state. 11/10 tranquil af https://t.co/Z167HgtnBi,https://twitter.com/dog_rates/status/728015554473250816/photo/1,Rueben,pupper,1.1,https://pbs.twimg.com/media/ChpuRyvVAAARMoq.jpg,cocker_spaniel,0.384559,True,golden_retriever,0.091661,True,sandbar,0.0817989,False,1219,4479
725786712245440512,2016-04-28 20:40:11+00:00,Say hello to Lillie. She's a Rutabagan Floofem. Poor pupper ate and then passed out. 11/10 relatable af https://t.co/uIdGqug9rw,https://twitter.com/dog_rates/status/725786712245440512/photo/1,Lillie,pupper,1.1,https://pbs.twimg.com/media/ChKDKmIWIAIJP_e.jpg,chow,0.33576100000000003,True,Samoyed,0.167173,True,kuvasz,0.145715,True,1527,4537
724405726123311104,2016-04-25 01:12:38+00:00,This is Ashleigh. She's having Coachella withdrawals. Didn't even go tho. 10/10 stay strong pupper https://t.co/nRUaKWnJfH,https://twitter.com/dog_rates/status/724405726123311104/photo/1,Ashleigh,pupper,1.0,https://pbs.twimg.com/media/Cg2bKLAWwAA0WEm.jpg,golden_retriever,0.240695,True,cocker_spaniel,0.202444,True,feather_boa,0.159348,False,1847,5800
721001180231503872,2016-04-15 15:44:11+00:00,This is Oliver. Bath time is upon him. His fear of the wetness postpones his ultimate pupper destiny. 11/10 https://t.co/AFzzKqR4tT,https://twitter.com/dog_rates/status/721001180231503872/photo/1,Oliver,pupper,1.1,https://pbs.twimg.com/media/CgGCvxAUkAAx55r.jpg,Samoyed,0.950053,True,washbasin,0.00632139,False,tub,0.00624335,False,686,2748
717009362452090880,2016-04-04 15:22:08+00:00,This is Smokey. He's having some sort of existential crisis. 10/10 hang in there pupper https://t.co/JmgF4dMpw0,https://twitter.com/dog_rates/status/717009362452090881/photo/1,Smokey,pupper,1.0,https://pbs.twimg.com/media/CfNUNetW8AAekHx.jpg,Siberian_husky,0.506154,True,Eskimo_dog,0.269656,True,malamute,0.0606585,True,1102,3583
711008018775851008,2016-03-19 01:54:56+00:00,This is Chuckles. He had a balloon but he accidentally let go of it and it floated away. 11/10 hang in there pupper https://t.co/68iNM7B5gW,https://twitter.com/dog_rates/status/711008018775851008/photo/1,Chuckles,pupper,1.1,https://pbs.twimg.com/media/Cd4CBQFW8AAY3ND.jpg,French_bulldog,0.731405,True,Boston_bull,0.150672,True,pug,0.0218109,True,710,3275
707315916783140864,2016-03-08 21:23:50+00:00,This is Finnegus. He's trapped in a snow globe. Poor pupper. 10/10 would make sure no one shook it https://t.co/BjpOa52jQ4,"https://twitter.com/dog_rates/status/707315916783140866/photo/1,https://twitter.com/dog_rates/status/707315916783140866/photo/1",Finnegus,pupper,1.0,https://pbs.twimg.com/media/CdDkEkHWwAAAeUJ.jpg,Bernese_mountain_dog,0.979235,True,Shetland_sheepdog,0.0110368,True,Appenzeller,0.00397111,True,727,2698
705975130514706432,2016-03-05 04:36:02+00:00,This is Adele. Her tongue flies out of her mouth at random. It's a debilitating illness. 10/10 stay strong pupper https://t.co/cfn81n3FLO,"https://twitter.com/dog_rates/status/705975130514706432/photo/1,https://twitter.com/dog_rates/status/705975130514706432/photo/1",Adele,pupper,1.0,https://pbs.twimg.com/media/CcwgjmuXIAEQoSd.jpg,Staffordshire_bullterrier,0.5877640000000001,True,American_Staffordshire_terrier,0.281429,True,bull_mastiff,0.0947981,True,842,3397
705428427625635840,2016-03-03 16:23:38+00:00,This is Ambrose. He's an Alfalfa Ballyhoo. Draws pistol fast af. Pretty much runs the frontier. 11/10 lethal pupper https://t.co/ih6epBOxIA,https://twitter.com/dog_rates/status/705428427625635840/photo/1,Ambrose,pupper,1.1,https://pbs.twimg.com/media/CcovaMUXIAApFDl.jpg,Chihuahua,0.774792,True,quilt,0.0730794,False,Pembroke,0.0223651,True,1931,4188
703611486317502464,2016-02-27 16:03:45+00:00,Meet Scooter. He's experiencing the pupper equivalent of dropping ur phone in a toilet 10/10 put it in some rice pup https://t.co/JSmX1FIEaW,https://twitter.com/dog_rates/status/703611486317502464/photo/1,Scooter,pupper,1.0,https://pbs.twimg.com/media/CcO66OjXEAASXmH.jpg,Pembroke,0.756441,True,basenji,0.126621,True,Cardigan,0.08011669999999999,True,1709,4229
702598099714314240,2016-02-24 20:56:55+00:00,"This is Sansa. She's gotten too big for her chair. Not so smol anymore. 11/10 once a pupper, always a pupper https://t.co/IpAoztle2s",https://twitter.com/dog_rates/status/702598099714314240/photo/1,Sansa,pupper,1.1,https://pbs.twimg.com/media/CcAhPevW8AAoknv.jpg,kelpie,0.219179,True,badger,0.13358399999999998,False,Siamese_cat,0.07443999999999999,False,3712,11332
701545186879471616,2016-02-21 23:13:01+00:00,Meet Millie. She's practicing her dive form for Rio. It's nearly perfect. Dedicated af. 10/10 go for gold pupper https://t.co/SDVkc4m96M,https://twitter.com/dog_rates/status/701545186879471618/photo/1,Millie,pupper,1.0,https://pbs.twimg.com/media/CbxjnyOWAAAWLUH.jpg,Border_collie,0.280893,True,Cardigan,0.11255,True,toy_terrier,0.0533172,True,680,2902
699801817392291840,2016-02-17 03:45:29+00:00,This is Cooper. He began to tear up when his bone was taken from him. 11/10 stay strong pupper https://t.co/qI8yvqKG02,"https://twitter.com/dog_rates/status/699801817392291840/photo/1,https://twitter.com/dog_rates/status/699801817392291840/photo/1,https://twitter.com/dog_rates/status/699801817392291840/photo/1,https://twitter.com/dog_rates/status/699801817392291840/photo/1",Cooper,pupper,1.1,https://pbs.twimg.com/media/CbYyCMcWIAAHHjF.jpg,golden_retriever,0.808978,True,Irish_setter,0.0424281,True,Labrador_retriever,0.0235364,True,1088,3345
695074328191332352,2016-02-04 02:40:08+00:00,This is Lorenzo. He's educated af. Just graduated college. 11/10 poor pupper can't even comprehend his debt https://t.co/dH3GzcjCtQ,https://twitter.com/dog_rates/status/695074328191332352/photo/1,Lorenzo,pupper,1.1,https://pbs.twimg.com/media/CaVmajOWYAA1uNG.jpg,Shih-Tzu,0.5101060000000001,True,Tibetan_terrier,0.0719809,True,Lhasa,0.069231,True,1239,3116
694329668942569472,2016-02-02 01:21:07+00:00,Meet Grady. He's very hungry. Too bad no one can find his food bowl. 9/10 poor pupper https://t.co/oToIkYnEGn,https://twitter.com/dog_rates/status/694329668942569472/photo/1,Grady,pupper,0.9,https://pbs.twimg.com/media/CaLBJmOWYAQt44t.jpg,boxer,0.99006,True,bull_mastiff,0.00743627,True,Saint_Bernard,0.00161729,True,569,2203
692905862751522816,2016-01-29 03:03:25+00:00,This is Wally. He's being abducted by aliens. 10/10 poor pupper https://t.co/EiF659Bgjn,https://twitter.com/dog_rates/status/692905862751522816/photo/1,Wally,pupper,1.0,https://pbs.twimg.com/media/CZ2yNKhWEAA_7cb.jpg,Mexican_hairless,0.162638,True,Doberman,0.15628699999999998,True,Rhodesian_ridgeback,0.0814778,True,998,2683
689905486972461056,2016-01-20 20:21:00+00:00,"Say hello to Gizmo. He's quite the pupper. Confused by bed, but agile af. Can barely catch on camera. 11/10 so quick https://t.co/IE4ZblyZRY","https://twitter.com/dog_rates/status/689905486972461056/photo/1,https://twitter.com/dog_rates/status/689905486972461056/photo/1,https://twitter.com/dog_rates/status/689905486972461056/photo/1,https://twitter.com/dog_rates/status/689905486972461056/photo/1",Gizmo,pupper,1.1,https://pbs.twimg.com/media/CZMJYCRVAAE35Wk.jpg,Pomeranian,0.943331,True,Shetland_sheepdog,0.0236751,True,chow,0.00716495,True,787,2651
689623661272240128,2016-01-20 01:41:08+00:00,This is Lucy. She's terrified of the stuffed billed dog. 10/10 stay strong pupper https://t.co/QnvSjjyh7n,"https://twitter.com/dog_rates/status/689623661272240129/photo/1,https://twitter.com/dog_rates/status/689623661272240129/photo/1",Lucy,pupper,1.0,https://pbs.twimg.com/media/CZIJD2SWIAMJgNI.jpg,toy_poodle,0.279604,True,mashed_potato,0.208564,False,Labrador_retriever,0.07748089999999999,True,748,2467
689143371370250240,2016-01-18 17:52:38+00:00,Meet Trip. He likes wearing costumes that aren't consistent with the season to screw with people 10/10 tricky pupper https://t.co/40w7TI5Axv,https://twitter.com/dog_rates/status/689143371370250240/photo/1,Trip,pupper,1.0,https://pbs.twimg.com/media/CZBUO2UWsAAKehS.jpg,English_springer,0.303781,True,papillon,0.165132,True,Welsh_springer_spaniel,0.149051,True,579,2232
687704180304273408,2016-01-14 18:33:48+00:00,Say hello to Blakely. He thinks that's a hat. Silly pupper. That's a nanner. 9/10 https://t.co/UwOV1jqKRt,https://twitter.com/dog_rates/status/687704180304273409/photo/1,Blakely,pupper,0.9,https://pbs.twimg.com/media/CYs3TKzUAAAF9A2.jpg,miniature_pinscher,0.956063,True,toy_terrier,0.0122306,True,Chihuahua,0.00539748,True,950,2660
686683045143953408,2016-01-11 22:56:10+00:00,This is Mona. She's a Yarborough Splishnsplash. Lost body during Nam. 11/10 revolutionary pupper https://t.co/pgD6h0yhgz,https://twitter.com/dog_rates/status/686683045143953408/photo/1,Mona,pupper,1.1,https://pbs.twimg.com/media/CYeWlh0WAAADhsj.jpg,Norwich_terrier,0.100499,True,cocker_spaniel,0.0806711,True,golden_retriever,0.0794062,True,912,3072
686618349602762752,2016-01-11 18:39:05+00:00,This is Olivia. She just saw an adult wearing crocs. 11/10 poor pupper. No one should witness such a thing https://t.co/yJVTi1DjJc,https://twitter.com/dog_rates/status/686618349602762752/photo/1,Olivia,pupper,1.1,https://pbs.twimg.com/media/CYdbvwjWcAEtjYu.jpg,Rottweiler,0.441331,True,miniature_pinscher,0.23318000000000005,True,Gordon_setter,0.093582,True,1544,4042
686377065986265088,2016-01-11 02:40:19+00:00,Meet Birf. He thinks he's gone blind. 10/10 very frightened pupper https://t.co/oDkspjNWYX,https://twitter.com/dog_rates/status/686377065986265092/photo/1,Birf,pupper,1.0,https://pbs.twimg.com/media/CYaAS2kUoAINkye.jpg,German_shepherd,0.830816,True,Leonberg,0.0763252,True,bloodhound,0.0374486,True,637,2433
685641971164143616,2016-01-09 01:59:19+00:00,This is Otis. He just passed a cop while going 61 in a 45. Very nervous pupper. 7/10 https://t.co/jJS8qQeuNO,https://twitter.com/dog_rates/status/685641971164143616/photo/1,Otis,pupper,0.7,https://pbs.twimg.com/media/CYPjvFqW8AAgiP2.jpg,Lakeland_terrier,0.253839,True,Airedale,0.213349,True,three-toed_sloth,0.0838341,False,885,3218
685268753634967552,2016-01-08 01:16:17+00:00,This is Hubertson. He's a Carmel Haberdashery. Enjoys long summer days on his boat. Very peaceful pupper. 10/10 https://t.co/vzCl35fKlZ,https://twitter.com/dog_rates/status/685268753634967552/photo/1,Hubertson,pupper,1.0,https://pbs.twimg.com/media/CYKQS0xUQAEOptC.jpg,pug,0.999044,True,Norwegian_elkhound,0.000546586,True,bull_mastiff,0.000235195,True,1371,3419
685169283572338688,2016-01-07 18:41:01+00:00,Meet Gerbald. He just found out he's adopted. Poor pupper. Snazzy tongue tho. 11/10 would hold close in time of need https://t.co/UfGkB9Wrud,https://twitter.com/dog_rates/status/685169283572338688/photo/1,Gerbald,pupper,1.1,https://pbs.twimg.com/media/CYI10WhWsAAjzii.jpg,Bernese_mountain_dog,0.975096,True,Appenzeller,0.0145781,True,EntleBucher,0.00594348,True,1620,4489
683481228088049664,2016-01-03 02:53:17+00:00,Meet Banjo. He's a Peppercorn Shoop Da Whoop. Nails look lethal. Skeptical of luminescent orb 11/10 stay woke pupper https://t.co/H7NZFumpKq,https://twitter.com/dog_rates/status/683481228088049664/photo/1,Banjo,pupper,1.1,https://pbs.twimg.com/media/CXw2jSpWMAAad6V.jpg,keeshond,0.508951,True,chow,0.442016,True,German_shepherd,0.013206,True,1118,2878
683142553609318400,2016-01-02 04:27:31+00:00,Meet Brandy. She's a member of the Bloods. Menacing criminal pupper. Soft spot for flowers tho. 9/10 pet w caution https://t.co/hhIA3coiAJ,https://twitter.com/dog_rates/status/683142553609318400/photo/1,Brandy,pupper,0.9,https://pbs.twimg.com/media/CXsChyjW8AQJ16C.jpg,Leonberg,0.605851,True,chow,0.18347,True,German_shepherd,0.0796619,True,1173,3162
683111407806746624,2016-01-02 02:23:45+00:00,This is Larry. He thought the New Year's parties were tonight. 10/10 poor pupper. Maybe next year https://t.co/h3X0jK8MVM,https://twitter.com/dog_rates/status/683111407806746624/photo/1,Larry,pupper,1.0,https://pbs.twimg.com/media/CXrmMSpUwAAdeRj.jpg,cocker_spaniel,0.901392,True,soft-coated_wheaten_terrier,0.0286048,True,miniature_schnauzer,0.0178054,True,1034,3736
681891461017812992,2015-12-29 17:36:07+00:00,Say hello to Charlie. He's scholarly af. Quite intimidating with all his pupper knowledge 10/10 even built that fire https://t.co/9KThv6z8u5,https://twitter.com/dog_rates/status/681891461017812993/photo/1,Charlie,pupper,1.0,https://pbs.twimg.com/media/CXaQqGbWMAAKEgN.jpg,Chihuahua,0.20357,True,doormat,0.13431600000000002,False,toy_terrier,0.0844823,True,951,2706
681694085539872768,2015-12-29 04:31:49+00:00,This is Bo. He's a Benedoop Cumbersnatch. Seems frustrated with own feet. Portable as hell. 11/10 very solid pupper https://t.co/TONMhRoQh7,https://twitter.com/dog_rates/status/681694085539872773/photo/1,Bo,pupper,1.1,https://pbs.twimg.com/media/CXXdJ7CVAAALu23.jpg,toy_poodle,0.920992,True,miniature_poodle,0.0608572,True,Maltese_dog,0.00606372,True,4581,14010
681654059175129088,2015-12-29 01:52:46+00:00,This is Toffee. He's a happy pupper. Appears dangerously fluffy. Extraordinarily spherical. 12/10 would pet firmly https://t.co/oEXEKt3MHu,https://twitter.com/dog_rates/status/681654059175129088/photo/1,Toffee,pupper,1.2,https://pbs.twimg.com/media/CXW4wGHWsAE_eBD.jpg,Pomeranian,0.800538,True,chow,0.146892,True,Pekinese,0.0376125,True,1045,2903
680836378243002368,2015-12-26 19:43:36+00:00,This is Ellie. She's secretly ferocious. 12/10 very deadly pupper https://t.co/BF4BW8LUgb,"https://twitter.com/dog_rates/status/680836378243002368/photo/1,https://twitter.com/dog_rates/status/680836378243002368/photo/1,https://twitter.com/dog_rates/status/680836378243002368/photo/1",Ellie,pupper,1.2,https://pbs.twimg.com/media/CXLREjOW8AElfk6.jpg,Pembroke,0.427781,True,Shetland_sheepdog,0.160669,True,Pomeranian,0.11125,True,1513,3766
680473011644985344,2015-12-25 19:39:43+00:00,"This is Hector. He thinks he's a hammer. Silly Hector. You're a pupper, not a hammer. 10/10 https://t.co/OdUFuZIXiI",https://twitter.com/dog_rates/status/680473011644985345/photo/1,Hector,pupper,1.0,https://pbs.twimg.com/media/CXGGlzvWYAArPfk.jpg,Lakeland_terrier,0.796694,True,West_Highland_white_terrier,0.138709,True,Norwich_terrier,0.016253399999999998,True,844,2778
680145970311643136,2015-12-24 22:00:10+00:00,Say hello to Kawhi. He was doing fine until his hat fell off. He got it back though. 10/10 deep breaths pupper https://t.co/N5pM6WBx7e,"https://twitter.com/dog_rates/status/680145970311643136/photo/1,https://twitter.com/dog_rates/status/680145970311643136/photo/1,https://twitter.com/dog_rates/status/680145970311643136/photo/1",Kawhi,pupper,1.0,https://pbs.twimg.com/media/CXBdJxLUsAAWql2.jpg,miniature_poodle,0.457117,True,toy_poodle,0.226481,True,Maltese_dog,0.0676815,True,1972,3955
679777920601223168,2015-12-23 21:37:40+00:00,This is Rinna. She's melting. 10/10 get inside pupper https://t.co/PA0czwucsb,https://twitter.com/dog_rates/status/679777920601223168/photo/1,Rinna,pupper,1.0,https://pbs.twimg.com/media/CW8OYajUMAAPRoF.jpg,bloodhound,0.5288189999999999,True,bull_mastiff,0.420119,True,French_bulldog,0.00948059,True,1281,3390
678389028614488064,2015-12-20 01:38:42+00:00,"This is Bella. She just learned that her final grade in chem was a 92.49 
poor pupper 11/10 https://t.co/auOoKuoveM",https://twitter.com/dog_rates/status/678389028614488064/photo/1,Bella,pupper,1.1,https://pbs.twimg.com/media/CWofOHUWUAACGVa.jpg,miniature_pinscher,0.516284,True,kelpie,0.227402,True,vizsla,0.103246,True,473,2044
676603393314578432,2015-12-15 03:23:14+00:00,This is Godzilla pupper. He had a ruff childhood &amp; now deflects that pain outward by terrorizing cities. Tragic 9/10 https://t.co/g1tLGkyaxr,https://twitter.com/dog_rates/status/676603393314578432/photo/1,Godzilla,pupper,0.9,https://pbs.twimg.com/media/CWPHMqKVAAAE78E.jpg,whippet,0.8770209999999999,True,Great_Dane,0.0341819,True,boxer,0.028404,True,440,1280
675845657354215424,2015-12-13 01:12:15+00:00,"This is Pepper. She's not fully comfortable riding her imaginary bike yet. 10/10 don't worry pupper, it gets easier https://t.co/40dj4eTsXG",https://twitter.com/dog_rates/status/675845657354215424/photo/1,Pepper,pupper,1.0,https://pbs.twimg.com/media/CWEWClfW4AAnqhG.jpg,pug,0.8839520000000001,True,Boston_bull,0.0110568,True,French_bulldog,0.00983981,True,1000,2477
675006312288268288,2015-12-10 17:37:00+00:00,Say hello to Mollie. This pic was taken after she bet all her toys on Ronda Rousey. 10/10 hang in there pupper https://t.co/QMmAqA9VqO,https://twitter.com/dog_rates/status/675006312288268288/photo/1,Mollie,pupper,1.0,https://pbs.twimg.com/media/CV4aqCwWsAIi3OP.jpg,boxer,0.654697,True,space_heater,0.043388800000000005,False,beagle,0.0428476,True,252,1057
674774481756377088,2015-12-10 02:15:47+00:00,This is Superpup. His head isn't proportional to his body. Has yet to serve any justice. 11/10 maybe one day pupper https://t.co/gxIFgg8ktm,https://twitter.com/dog_rates/status/674774481756377088/photo/1,Superpup,pupper,1.1,https://pbs.twimg.com/media/CV1HztsWoAAuZwo.jpg,Chihuahua,0.407016,True,French_bulldog,0.30997800000000003,True,Siamese_cat,0.227677,False,532,1213
674737130913071104,2015-12-09 23:47:22+00:00,Meet Rufio. He is unaware of the pink legless pupper wrapped around him. Might want to get that checked 10/10 &amp; 4/10 https://t.co/KNfLnYPmYh,https://twitter.com/dog_rates/status/674737130913071104/photo/1,Rufio,pupper,1.0,https://pbs.twimg.com/media/CV0l10AU8AAfg-a.jpg,Pomeranian,0.948537,True,schipperke,0.0143099,True,Chihuahua,0.00812024,True,103,693
674262580978937856,2015-12-08 16:21:41+00:00,This is Gus. He's super stoked about being an elephant. Couldn't be happier. 9/10 for elephant pupper https://t.co/gJS1qU0jP7,https://twitter.com/dog_rates/status/674262580978937856/photo/1,Gus,pupper,0.9,https://pbs.twimg.com/media/CVt2PawWIAEUkqW.jpg,Greater_Swiss_Mountain_dog,0.519428,True,boxer,0.1215,True,Staffordshire_bullterrier,0.114498,True,498,1391
674038233588723712,2015-12-08 01:30:12+00:00,This is Kaiya. She's an aspiring shoe model. 12/10 follow your dreams pupper https://t.co/nX8FiGRHvk,https://twitter.com/dog_rates/status/674038233588723717/photo/1,Kaiya,pupper,1.2,https://pbs.twimg.com/media/CVqqMtiVEAEye_L.jpg,Eskimo_dog,0.358459,True,Norwegian_elkhound,0.206963,True,malamute,0.14823599999999998,True,456,1176
673707060090052608,2015-12-07 03:34:14+00:00,This is Raymond. He's absolutely terrified of floating tennis ball. 10/10 it'll be ok pupper https://t.co/QyH1CaY3SM,"https://twitter.com/dog_rates/status/673707060090052608/photo/1,https://twitter.com/dog_rates/status/673707060090052608/photo/1",Raymond,pupper,1.0,https://pbs.twimg.com/media/CVl8_EPWoAAcuSC.jpg,German_short-haired_pointer,0.935771,True,kelpie,0.022561,True,Labrador_retriever,0.00884665,True,434,1177
673656262056419328,2015-12-07 00:12:23+00:00,This is Albert AKA King Banana Peel. He's a kind ruler of the kitchen. Very jubilant pupper. 10/10 overall great dog https://t.co/PN8hxgZ9We,https://twitter.com/dog_rates/status/673656262056419329/photo/1,Albert,pupper,1.0,https://pbs.twimg.com/media/CVlOy3pW4AQ9H1K.jpg,bull_mastiff,0.700625,True,Rhodesian_ridgeback,0.0946977,True,Brabancon_griffon,0.0575594,True,265,769
673612854080196608,2015-12-06 21:19:54+00:00,This is Jeffri. He's a speckled ice pupper. Very lazy. Enjoys the occasional swim. Rather majestic really. 7/10 https://t.co/0iyItbtkr8,https://twitter.com/dog_rates/status/673612854080196609/photo/1,Jeffri,pupper,0.7,https://pbs.twimg.com/media/CVknUTlVEAARjU5.jpg,Newfoundland,0.223101,True,Leonberg,0.111106,True,shovel,0.0856263,False,802,1691
673295268553605120,2015-12-06 00:17:55+00:00,Meet Eve. She's a raging alcoholic 8/10 (would b 11/10 but pupper alcoholism is a tragic issue that I can't condone) https://t.co/U36HYQIijg,https://twitter.com/dog_rates/status/673295268553605120/photo/1,Eve,pupper,0.8,https://pbs.twimg.com/media/CVgGc9hWIAIe1bn.jpg,golden_retriever,0.889241,True,Labrador_retriever,0.06468330000000001,True,Great_Pyrenees,0.0126126,True,3484,8046
672988786805112832,2015-12-05 04:00:04+00:00,This is Schnozz. He's had a blurred tail since birth. Hasn't let that stop him. 10/10 inspirational pupper https://t.co/a3zYMcvbXG,https://twitter.com/dog_rates/status/672988786805112832/photo/1,Schnozz,pupper,1.0,https://pbs.twimg.com/media/CVbvjKqW4AA_CuD.jpg,Lakeland_terrier,0.8366319999999999,True,West_Highland_white_terrier,0.07389960000000001,True,wire-haired_fox_terrier,0.0381601,True,314,1039
672975131468300288,2015-12-05 03:05:49+00:00,This is Chuckles. He is one skeptical pupper. 10/10 stay woke Chuckles https://t.co/ZlcF0TIRW1,https://twitter.com/dog_rates/status/672975131468300288/photo/1,Chuckles,pupper,1.0,https://pbs.twimg.com/media/CVbjRSIWsAElw2s.jpg,pug,0.8364209999999999,True,Brabancon_griffon,0.044667800000000014,True,French_bulldog,0.0365705,True,1015,1813
672594978741354496,2015-12-04 01:55:13+00:00,Meet Scott. Just trying to catch his train to work. Doesn't need everybody staring. 9/10 ignore the haters pupper https://t.co/jyXbZ35MYz,https://twitter.com/dog_rates/status/672594978741354496/photo/1,Scott,pupper,0.9,https://pbs.twimg.com/media/CVWJkJXWsAInlZl.jpg,Great_Pyrenees,0.755945,True,Old_English_sheepdog,0.0823368,True,Afghan_hound,0.0270366,True,661,1411
